{
  "$schema": "./lesson-config.schema.json",
  "schema_version": "1.0",
  "repository": {
    "owner": "mohammadrezwankhan",
    "slug": "matlab-simulink-energy-lab",
    "name": "matlab-simulink-energy-lab",
    "title": "MATLAB Simulink Energy Lab",
    "url": "https://github.com/mohammadrezwankhan/matlab-simulink-energy-lab",
    "default_branch": "main",
    "description": "Run reduced-order battery, thermal, converter and BESS control models with transparent equations and repeatable testing.",
    "summary": "The native repository contains Base MATLAB and generated Simulink models for batteries, thermal response, converters, and BESS control. A second-order response exercise develops control intuition before the bounded native examples.",
    "audience": "Electrical-engineering students, MATLAB users, and researchers studying reproducible reduced-order models.",
    "topics": [
      "matlab",
      "simulink",
      "battery-modeling",
      "state-of-charge",
      "extended-kalman-filter",
      "battery-thermal-management",
      "power-electronics",
      "dc-dc-converter",
      "bess",
      "grid-forming",
      "grid-following",
      "control-systems",
      "model-based-design",
      "simulation",
      "engineering-education"
    ],
    "source_paths": [
      "README.md",
      "buildfile.m",
      "examples/README.md",
      "docs/model-selection-guide.md",
      "docs/battery-pulse-response-lab.md",
      "examples/battery-rc-model/check_battery_rc_model.m",
      "examples/converter-closed-loop-model/README.md",
      "examples/converter-closed-loop-model/simulate_closed_loop_converter.m",
      "examples/run_base_matlab_checks.m",
      "examples/bess-unified-control/docs/limitations.md"
    ],
    "is_fork": false,
    "upstream": null
  },
  "domain": {
    "id": "D",
    "name": "Simulation and digital twins",
    "primary": "#FF6D00",
    "secondary": "#00B0FF",
    "surface": "#1A1412",
    "glow": "rgba(255,109,0,0.35)"
  },
  "model": {
    "title": "Control intuition · analytic step response",
    "timeUnit": "s",
    "horizon": 20,
    "parameters": [
      {
        "key": "setpoint",
        "label": "Step target",
        "unit": "units",
        "min": 10,
        "max": 100,
        "step": 5,
        "default": 60,
        "calibration": "Illustrative input; verified against the declared analytical model, not field measurements."
      },
      {
        "key": "damping",
        "label": "Damping ratio",
        "unit": "ζ",
        "min": 0.1,
        "max": 2,
        "step": 0.05,
        "default": 0.5,
        "calibration": "Illustrative input; verified against the declared analytical model, not field measurements."
      },
      {
        "key": "naturalFrequency",
        "label": "Natural frequency",
        "unit": "rad/s",
        "min": 0.2,
        "max": 3,
        "step": 0.1,
        "default": 1,
        "calibration": "Illustrative input; verified against the declared analytical model, not field measurements."
      },
      {
        "key": "gain",
        "label": "Steady-state gain",
        "unit": "×",
        "min": 0.5,
        "max": 1.5,
        "step": 0.05,
        "default": 1,
        "calibration": "Illustrative input; verified against the declared analytical model, not field measurements."
      }
    ],
    "metrics": [
      {
        "key": "output",
        "label": "System output",
        "unit": "units",
        "decimals": 2
      },
      {
        "key": "error",
        "label": "Tracking error",
        "unit": "units",
        "decimals": 2
      },
      {
        "key": "velocity",
        "label": "Output rate",
        "unit": "units/s",
        "decimals": 2
      },
      {
        "key": "overshootPct",
        "label": "Theoretical overshoot",
        "unit": "%",
        "decimals": 1
      }
    ],
    "equation": "y″ + 2ζωₙy′ + ωₙ²y = Kωₙ²r. Closed-form unit-step response is evaluated for underdamped, critical, and overdamped regimes.",
    "assumptions": [
      "A linear time-invariant second-order system starts at rest.",
      "No transport delay, saturation, sensor noise, or discrete controller is represented.",
      "Overshoot is relative to the final K·r level; tracking error remains relative to the requested r.",
      "The 20-second response is deliberately rescaled for learning; it does not use the native converter’s electrical constants or subsecond scenario.",
      "No MATLAB or Simulink engine is embedded in this page. Native scripts and toolbox requirements remain available through the source links.",
      "Analytic agreement is numerical verification, not measured battery, inverter, grid-code, or hardware validation."
    ],
    "kind": "control",
    "introduction": "The browser uses an ideal linear second-order system, not the repository’s actual buck-converter, EKF, or BESS controller. Use it to predict damping and gain effects before inspecting the native saturation, sample-time, and validation contracts.",
    "calibration_status": "Uncalibrated synthetic teaching proxy"
  },
  "modules": [
    {
      "id": "module-1",
      "title": "Predict a control response from its equation",
      "objective": "Identify target, damping, natural frequency, and gain in a small dynamic model.",
      "minutes": 12,
      "steps": [
        "Read the native closed-loop converter engineering question and its two state equations.",
        "Apply a 60-unit step with damping 0.5, natural frequency 1 rad/s, and unit gain.",
        "Predict overshoot and final tracking before running the deliberately slower browser response."
      ],
      "preset": {
        "setpoint": 60,
        "damping": 0.5,
        "naturalFrequency": 1,
        "gain": 1
      },
      "checkpoints": [
        {
          "label": "Theoretical overshoot for the initial damping",
          "metric": "overshootPct",
          "operator": "==",
          "expected": 16.303353,
          "tolerance": 0.02,
          "atTime": 20
        },
        {
          "label": "Output near the 60-unit final target",
          "metric": "output",
          "operator": "==",
          "expected": 60.001458,
          "tolerance": 0.02,
          "atTime": 20
        }
      ],
      "reflection": "Which native converter states, actuator limits, and sample-time choices are absent from this ideal response?",
      "source_paths": [
        "examples/converter-closed-loop-model/README.md",
        "examples/converter-closed-loop-model/simulate_closed_loop_converter.m"
      ],
      "level": "Foundation"
    },
    {
      "id": "module-2",
      "title": "Change response speed while keeping damping",
      "objective": "Distinguish natural frequency from damping and steady-state gain.",
      "minutes": 15,
      "steps": [
        "Keep the step, gain, and damping fixed; double natural frequency to 2 rad/s.",
        "Compare the response at two seconds and the theoretical overshoot.",
        "Read the model-selection guide and identify a native model suitable for a converter-control question."
      ],
      "preset": {
        "setpoint": 60,
        "damping": 0.5,
        "naturalFrequency": 2,
        "gain": 1
      },
      "checkpoints": [
        {
          "label": "Faster system output after two seconds",
          "metric": "output",
          "operator": "==",
          "expected": 69.187366,
          "tolerance": 0.02,
          "atTime": 2
        },
        {
          "label": "Theoretical overshoot is unchanged",
          "metric": "overshootPct",
          "operator": "==",
          "expected": 16.303353,
          "tolerance": 0.02,
          "atTime": 20
        }
      ],
      "reflection": "Why does doubling a natural frequency in this toy not justify doubling controller gains in the native plant?",
      "source_paths": [
        "docs/model-selection-guide.md",
        "examples/converter-closed-loop-model/README.md"
      ],
      "level": "Parameter study"
    },
    {
      "id": "module-3",
      "title": "Use a limiting case as a verification check",
      "objective": "Explain the value and scope of an analytic reference case.",
      "minutes": 15,
      "steps": [
        "Set damping to 1, frequency to 1 rad/s, and keep unit gain.",
        "Predict a monotonic critical response and inspect the one-second and final outputs.",
        "Find the Base MATLAB check entry point and distinguish a no-plot regression from a displayed figure."
      ],
      "preset": {
        "setpoint": 60,
        "damping": 1,
        "naturalFrequency": 1,
        "gain": 1
      },
      "checkpoints": [
        {
          "label": "Critical response has no theoretical overshoot",
          "metric": "overshootPct",
          "operator": "==",
          "expected": 0,
          "tolerance": 0.02,
          "atTime": 20
        },
        {
          "label": "Final tracking error is below 0.01 unit",
          "metric": "error",
          "operator": "<",
          "expected": 0.01,
          "tolerance": 0.02,
          "atTime": 20
        }
      ],
      "reflection": "What would a deterministic passing check establish, and what independent measurement evidence would still be missing?",
      "source_paths": [
        "examples/run_base_matlab_checks.m",
        "examples/battery-rc-model/check_battery_rc_model.m",
        "docs/battery-pulse-response-lab.md"
      ],
      "level": "Stress test"
    },
    {
      "id": "module-4",
      "title": "Choose the smallest defensible native model",
      "objective": "Carry an explicit control question into the repository’s model and validation map.",
      "minutes": 18,
      "steps": [
        "Apply gain 0.8 with damping 0.7 and natural frequency 1.5 rad/s.",
        "Predict the nonzero steady-state error even though the response is well damped.",